{
  "schema_version": 1,
  "node_id": "53494D0000000001",
  "source": "simulator",
  "session_id": "15f75ec4-29ab-48ab-93be-81d3e0708a68",
  "sequence": 130,
  "message_id": "53494D0000000001:15f75ec4-29ab-48ab-93be-81d3e0708a68:telemetry:130",
  "observed_at": "2026-10-08T14:00:00.000Z",
  "published_at": "2026-10-08T14:00:00.000Z",
  "clock_source": "simulator_host",
  "pack_voltage_reported": 13.21,
  "stack_voltage_reported": 13.19,
  "pack_current": -5,
  "soc": 74.2,
  "cell_voltages": [3.301, 3.299, 0, 3.301],
  "cell_voltage_min_reported": 3.299,
  "cell_voltage_max_reported": 3.305,
  "cell_voltage_avg_reported": 3.302,
  "cell_voltage_delta": 3.301,
  "cell_temperatures": [27.4, 28.1],
  "cell_temperature_max": 28.1,
  "ic_temperature": 33.1,
  "mosfet_temperature": 35.6,
  "shunt_temperature": null,
  "component_temperature_max": 35.6,
  "bms_state_code": 3,
  "bms_state": "NORMAL",
  "balancing_mask": 0,
  "error_flags": 0,
  "faults": [],
  "soh": null,
  "cycle_count": null,
  "quality": {
    "shunt_temperature": "unsupported",
    "soh": "unsupported",
    "cycle_count": "unsupported"
  }
}
