{
  "schema_version": 1,
  "node_id": "53494D0000000001",
  "source": "simulator",
  "session_id": "15f75ec4-29ab-48ab-93be-81d3e0708a68",
  "sequence": 121,
  "message_id": "53494D0000000001:15f75ec4-29ab-48ab-93be-81d3e0708a68:telemetry:121",
  "observed_at": "2026-10-13T12:00:01.000Z",
  "published_at": "2026-10-13T12:00:01.000Z",
  "clock_source": "simulator_host",
  "pack_voltage_reported": 14.52,
  "stack_voltage_reported": 14.5,
  "pack_current": 5.0,
  "soc": 98.5,
  "cell_voltages": [3.45, 3.68, 3.445, 3.445],
  "cell_voltage_min_reported": 3.445,
  "cell_voltage_max_reported": 3.68,
  "cell_voltage_avg_reported": 3.505,
  "cell_voltage_delta": 0.235,
  "cell_temperatures": [46.2, null],
  "cell_temperature_max": null,
  "ic_temperature": 38.0,
  "mosfet_temperature": 42.5,
  "shunt_temperature": null,
  "component_temperature_max": 42.5,
  "bms_state_code": 1,
  "bms_state": "CHG",
  "balancing_mask": 2,
  "error_flags": 514,
  "faults": ["cell_overvoltage", "charge_overtemperature"],
  "soh": null,
  "cycle_count": null,
  "quality": {
    "cell_temperatures[1]": "source_error",
    "cell_temperature_max": "incomplete",
    "shunt_temperature": "unsupported",
    "soh": "unsupported",
    "cycle_count": "unsupported"
  }
}
